{
  "generatedAt": "2026-10-03T10:24:20.059Z",
  "node": [
    {
      "version": "v26.10.0",
      "date": "2026-09-21",
      "files": [
        "aix-ppc64",
        "headers",
        "linux-arm64",
        "linux-ppc64le",
        "linux-s390x",
        "linux-x64",
        "linux-x64-musl",
        "osx-arm64-tar",
        "osx-x64-pkg",
        "osx-x64-tar",
        "src",
        "win-arm64-7z",
        "win-arm64-zip",
        "win-x64-7z",
        "win-x64-exe",
        "win-x64-msi",
        "win-x64-zip"
      ],
      "npm": "11.19.1",
      "v8": "14.6.202.34",
      "uv": "1.52.1",
      "zlib": "1.3.2.1-motley",
      "openssl": "3.5.8",
      "modules": "147",
      "lts": false,
      "security": false
    },
    {
      "version": "v26.9.0",
      "date": "2026-09-16",
      "files": [
        "aix-ppc64",
        "headers",
        "linux-arm64",
        "linux-ppc64le",
        "linux-s390x",
        "linux-x64",
        "linux-x64-musl",
        "osx-arm64-tar",
        "osx-x64-pkg",
        "osx-x64-tar",
        "src",
        "win-arm64-7z",
        "win-arm64-zip",
        "win-x64-7z",
        "win-x64-exe",
        "win-x64-msi",
        "win-x64-zip"
      ],
      "npm": "11.19.1",
      "v8": "14.6.202.34",
      "uv": "1.52.1",
      "zlib": "1.3.2.1-motley",
      "openssl": "3.5.8",
      "modules": "147",
      "lts": false,
      "security": false
    },
    {
      "version": "v26.8.2",
      "date": "2026-09-09",
      "files": [
        "aix-ppc64",
        "headers",
        "linux-arm64",
        "linux-ppc64le",
        "linux-s390x",
        "linux-x64",
        "linux-x64-musl",
        "osx-arm64-tar",
        "osx-x64-pkg",
        "osx-x64-tar",
        "src",
        "win-arm64-7z",
        "win-arm64-zip",
        "win-x64-7z",
        "win-x64-exe",
        "win-x64-msi",
        "win-x64-zip"
      ],
      "npm": "11.19.1",
      "v8": "14.6.202.34",
      "uv": "1.52.1",
      "zlib": "1.3.2.1-motley",
      "openssl": "3.5.8",
      "modules": "147",
      "lts": false,
      "security": false
    },
    {
      "version": "v25.9.0",
      "date": "2026-03-31",
      "files": [
        "aix-ppc64",
        "headers",
        "linux-arm64",
        "linux-ppc64le",
        "linux-s390x",
        "linux-x64",
        "osx-arm64-tar",
        "osx-x64-pkg",
        "osx-x64-tar",
        "src",
        "win-arm64-7z",
        "win-arm64-zip",
        "win-x64-7z",
        "win-x64-exe",
        "win-x64-msi",
        "win-x64-zip"
      ],
      "npm": "11.12.1",
      "v8": "14.1.146.11",
      "uv": "1.51.0",
      "zlib": "1.3.1",
      "openssl": "3.5.5",
      "modules": "141",
      "lts": false,
      "security": false
    },
    {
      "version": "v25.8.2",
      "date": "2026-03-24",
      "files": [
        "aix-ppc64",
        "headers",
        "linux-arm64",
        "linux-ppc64le",
        "linux-s390x",
        "linux-x64",
        "osx-arm64-tar",
        "osx-x64-pkg",
        "osx-x64-tar",
        "src",
        "win-arm64-7z",
        "win-arm64-zip",
        "win-x64-7z",
        "win-x64-exe",
        "win-x64-msi",
        "win-x64-zip"
      ],
      "npm": "11.11.1",
      "v8": "14.1.146.11",
      "uv": "1.51.0",
      "zlib": "1.3.1",
      "openssl": "3.5.5",
      "modules": "141",
      "lts": false,
      "security": true
    },
    {
      "version": "v25.8.1",
      "date": "2026-03-10",
      "files": [
        "aix-ppc64",
        "headers",
        "linux-arm64",
        "linux-ppc64le",
        "linux-s390x",
        "linux-x64",
        "osx-arm64-tar",
        "osx-x64-pkg",
        "osx-x64-tar",
        "src",
        "win-arm64-7z",
        "win-arm64-zip",
        "win-x64-7z",
        "win-x64-exe",
        "win-x64-msi",
        "win-x64-zip"
      ],
      "npm": "11.11.0",
      "v8": "14.1.146.11",
      "uv": "1.51.0",
      "zlib": "1.3.1",
      "openssl": "3.5.5",
      "modules": "141",
      "lts": false,
      "security": false
    },
    {
      "version": "v24.21.0",
      "date": "2026-09-07",
      "files": [
        "aix-ppc64",
        "headers",
        "linux-arm64",
        "linux-ppc64le",
        "linux-s390x",
        "linux-x64",
        "linux-x64-musl",
        "osx-arm64-tar",
        "osx-x64-pkg",
        "osx-x64-tar",
        "src",
        "win-arm64-7z",
        "win-arm64-zip",
        "win-x64-7z",
        "win-x64-exe",
        "win-x64-msi",
        "win-x64-zip"
      ],
      "npm": "11.19.0",
      "v8": "13.6.233.17",
      "uv": "1.52.1",
      "zlib": "1.3.2.1-motley",
      "openssl": "3.5.8",
      "modules": "137",
      "lts": "Krypton",
      "security": false
    },
    {
      "version": "v24.20.0",
      "date": "2026-08-26",
      "files": [
        "aix-ppc64",
        "headers",
        "linux-arm64",
        "linux-ppc64le",
        "linux-s390x",
        "linux-x64",
        "linux-x64-musl",
        "osx-arm64-tar",
        "osx-x64-pkg",
        "osx-x64-tar",
        "src",
        "win-arm64-7z",
        "win-arm64-zip",
        "win-x64-7z",
        "win-x64-exe",
        "win-x64-msi",
        "win-x64-zip"
      ],
      "npm": "11.19.0",
      "v8": "13.6.233.17",
      "uv": "1.52.1",
      "zlib": "1.3.2.1-motley",
      "openssl": "3.5.7",
      "modules": "137",
      "lts": "Krypton",
      "security": false
    },
    {
      "version": "v24.19.0",
      "date": "2026-08-03",
      "files": [
        "aix-ppc64",
        "headers",
        "linux-arm64",
        "linux-ppc64le",
        "linux-s390x",
        "linux-x64",
        "osx-arm64-tar",
        "osx-x64-pkg",
        "osx-x64-tar",
        "src",
        "win-arm64-7z",
        "win-arm64-zip",
        "win-x64-7z",
        "win-x64-exe",
        "win-x64-msi",
        "win-x64-zip"
      ],
      "npm": "11.17.0",
      "v8": "13.6.233.17",
      "uv": "1.52.1",
      "zlib": "1.3.2.1-motley",
      "openssl": "3.5.7",
      "modules": "137",
      "lts": "Krypton",
      "security": false
    },
    {
      "version": "v23.11.1",
      "date": "2025-05-14",
      "files": [
        "aix-ppc64",
        "headers",
        "linux-arm64",
        "linux-armv7l",
        "linux-ppc64le",
        "linux-s390x",
        "linux-x64",
        "osx-arm64-tar",
        "osx-x64-pkg",
        "osx-x64-tar",
        "src",
        "win-arm64-7z",
        "win-arm64-zip",
        "win-x64-7z",
        "win-x64-exe",
        "win-x64-msi",
        "win-x64-zip"
      ],
      "npm": "10.9.2",
      "v8": "12.9.202.28",
      "uv": "1.50.0",
      "zlib": "1.3.0.1-motley",
      "openssl": "3.0.16",
      "modules": "131",
      "lts": false,
      "security": true
    },
    {
      "version": "v23.11.0",
      "date": "2025-04-01",
      "files": [
        "aix-ppc64",
        "headers",
        "linux-arm64",
        "linux-armv7l",
        "linux-ppc64le",
        "linux-s390x",
        "linux-x64",
        "osx-arm64-tar",
        "osx-x64-pkg",
        "osx-x64-tar",
        "src",
        "win-arm64-7z",
        "win-arm64-zip",
        "win-x64-7z",
        "win-x64-exe",
        "win-x64-msi",
        "win-x64-zip"
      ],
      "npm": "10.9.2",
      "v8": "12.9.202.28",
      "uv": "1.50.0",
      "zlib": "1.3.0.1-motley",
      "openssl": "3.0.16",
      "modules": "131",
      "lts": false,
      "security": false
    },
    {
      "version": "v23.10.0",
      "date": "2025-03-13",
      "files": [
        "aix-ppc64",
        "headers",
        "linux-arm64",
        "linux-armv7l",
        "linux-ppc64le",
        "linux-s390x",
        "linux-x64",
        "osx-arm64-tar",
        "osx-x64-pkg",
        "osx-x64-tar",
        "src",
        "win-arm64-7z",
        "win-arm64-zip",
        "win-x64-7z",
        "win-x64-exe",
        "win-x64-msi",
        "win-x64-zip"
      ],
      "npm": "10.9.2",
      "v8": "12.9.202.28",
      "uv": "1.50.0",
      "zlib": "1.3.0.1-motley",
      "openssl": "3.0.16",
      "modules": "131",
      "lts": false,
      "security": false
    },
    {
      "version": "v22.23.3",
      "date": "2026-09-23",
      "files": [
        "aix-ppc64",
        "headers",
        "linux-arm64",
        "linux-armv7l",
        "linux-ppc64le",
        "linux-s390x",
        "linux-x64",
        "linux-x64-musl",
        "osx-arm64-tar",
        "osx-x64-pkg",
        "osx-x64-tar",
        "src",
        "win-arm64-7z",
        "win-arm64-zip",
        "win-x64-7z",
        "win-x64-exe",
        "win-x64-msi",
        "win-x64-zip",
        "win-x86-7z",
        "win-x86-exe",
        "win-x86-msi",
        "win-x86-zip"
      ],
      "npm": "10.9.9",
      "v8": "12.4.254.21",
      "uv": "1.51.0",
      "zlib": "1.3.1",
      "openssl": "3.5.8",
      "modules": "127",
      "lts": "Jod",
      "security": false
    },
    {
      "version": "v22.23.2",
      "date": "2026-07-28",
      "files": [
        "aix-ppc64",
        "headers",
        "linux-arm64",
        "linux-armv7l",
        "linux-ppc64le",
        "linux-s390x",
        "linux-x64",
        "osx-arm64-tar",
        "osx-x64-pkg",
        "osx-x64-tar",
        "src",
        "win-arm64-7z",
        "win-arm64-zip",
        "win-x64-7z",
        "win-x64-exe",
        "win-x64-msi",
        "win-x64-zip",
        "win-x86-7z",
        "win-x86-exe",
        "win-x86-msi",
        "win-x86-zip"
      ],
      "npm": "10.9.8",
      "v8": "12.4.254.21",
      "uv": "1.51.0",
      "zlib": "1.3.1",
      "openssl": "3.5.7",
      "modules": "127",
      "lts": "Jod",
      "security": true
    },
    {
      "version": "v22.23.1",
      "date": "2026-06-22",
      "files": [
        "aix-ppc64",
        "headers",
        "linux-arm64",
        "linux-armv7l",
        "linux-ppc64le",
        "linux-s390x",
        "linux-x64",
        "osx-arm64-tar",
        "osx-x64-pkg",
        "osx-x64-tar",
        "src",
        "win-arm64-7z",
        "win-arm64-zip",
        "win-x64-7z",